{
  "registry_version": "1.0.0",
  "updated_at": "2026-08-26",
  "policy": {
    "default_status": "unavailable",
    "allow_browser_direct_requests": false,
    "secret_policy": "No API key, token, cookie, or credential may appear in public HTML, JavaScript, JSON, logs, or URLs.",
    "failure_policy": "On timeout, CORS, rate limit, schema drift, stale data, or unclear licensing, return stale/error without fallback values."
  },
  "sources": [
    {
      "source_id": "fred",
      "display_name": "Federal Reserve Bank of St. Louis FRED",
      "official_url": "https://fred.stlouisfed.org/docs/api/fred/",
      "data_classes": ["macro_series", "release_metadata", "vintage_dates"],
      "coverage": ["US macroeconomic time series"],
      "frequencies": ["daily", "weekly", "monthly", "quarterly", "annual"],
      "adjustments": ["source_defined", "not_applicable"],
      "timezone": "source_defined",
      "currency": "source_defined",
      "license_ref": "fred:terms",
      "requires_api_key": true,
      "browser_direct_allowed": false,
      "typical_update_lag": "source_defined",
      "freshness_sla": "published schedule plus 90 minutes",
      "rate_limit_policy": "bounded retry with exponential backoff; respect provider terms",
      "error_codes": ["HTTP_400", "HTTP_403", "HTTP_429", "HTTP_500", "TIMEOUT", "SCHEMA_DRIFT", "STALE"],
      "owner": "research-data",
      "enabled": false,
      "notes": "Use series observations and vintage metadata; API credentials stay server-side."
    },
    {
      "source_id": "sec_edgar",
      "display_name": "U.S. Securities and Exchange Commission EDGAR APIs",
      "official_url": "https://www.sec.gov/search-filings/edgar-application-programming-interfaces",
      "data_classes": ["filing_submissions", "xbrl_companyfacts", "xbrl_frames"],
      "coverage": ["US public company filings"],
      "frequencies": ["event_driven", "daily_bulk"],
      "adjustments": ["as_reported"],
      "timezone": "US/Eastern",
      "currency": "filing_defined",
      "license_ref": "sec:privacy-and-security",
      "requires_api_key": false,
      "browser_direct_allowed": false,
      "typical_update_lag": "less than one minute for many XBRL APIs; source-defined",
      "freshness_sla": "filing dissemination plus 15 minutes",
      "rate_limit_policy": "identify client and comply with SEC privacy/security guidance",
      "error_codes": ["HTTP_403", "HTTP_429", "HTTP_500", "TIMEOUT", "SCHEMA_DRIFT", "STALE"],
      "owner": "research-data",
      "enabled": false,
      "notes": "Server-side adapter only; filed date and fiscal period remain separate fields."
    },
    {
      "source_id": "taifex_specs",
      "display_name": "Taiwan Futures Exchange contract specifications",
      "official_url": "https://www.taifex.com.tw/enl/eng2/tX",
      "data_classes": ["exchange_contract_specs"],
      "coverage": ["TAIEX futures and exchange-defined contract specifications"],
      "frequencies": ["event_driven"],
      "adjustments": ["not_applicable"],
      "timezone": "Asia/Taipei",
      "currency": "TWD",
      "license_ref": "taifex:official-publication",
      "requires_api_key": false,
      "browser_direct_allowed": false,
      "typical_update_lag": "publication-defined",
      "freshness_sla": "manual review before effective date",
      "rate_limit_policy": "manual or bounded server-side retrieval",
      "error_codes": ["HTTP_404", "HTTP_429", "TIMEOUT", "SCHEMA_DRIFT", "STALE"],
      "owner": "research-data",
      "enabled": false,
      "notes": "Treat multiplier, tick, trading hours, limits, settlement, and effective date as versioned fields."
    },
    {
      "source_id": "cme_education",
      "display_name": "CME Group futures education",
      "official_url": "https://www.cmegroup.com/education/courses/introduction-to-futures",
      "data_classes": ["derivatives_concepts"],
      "coverage": ["general futures concepts"],
      "frequencies": ["not_applicable"],
      "adjustments": ["not_applicable"],
      "timezone": "not_applicable",
      "currency": "not_applicable",
      "license_ref": "cme:education",
      "requires_api_key": false,
      "browser_direct_allowed": false,
      "typical_update_lag": "publication-defined",
      "freshness_sla": "review on content update",
      "rate_limit_policy": "bounded retrieval",
      "error_codes": ["HTTP_404", "TIMEOUT", "SCHEMA_DRIFT", "STALE"],
      "owner": "research-content",
      "enabled": false,
      "notes": "Concept reference only; never substitute it for an individual contract specification."
    }
  ]
}
